record_id,title,authors,year,source_db,venue,doi,subtopic,included,exclusion_reason,qac_score,nist_level,domain,migration_strategy,corpus_type,peer_reviewed,audit_note
057,Post-Quantum Authentication in TLS 1.3,Sikeridis et al.,2020,Other,NDSS,10.14722/ndss.2020.24203,TLS_Hybrid,1,,5,1/3,TLS/VPN,S4,REMOVED_DUP,N/A,"DUPLICATE: Duplicate of 047 (Sikeridis NDSS 2020, DOI 10.14722/ndss.2020.24203)"
068,pqm4: Testing and Benchmarking NIST PQC on ARM Cortex-M4,Kannwischer et al.,2019,Other,NIST Conf.,N/A,IoT_Embedded,1,,5,1/3,IoT,S10,REMOVED_DUP,N/A,"DUPLICATE: Duplicate of 019 (pqm4 Kannwischer, re-entered under IoT subtopic as NIST Conf.)"
069,CRYSTALS-Kyber on ARM Cortex-M4,Seo et al.,2020,IEEE_Xplore,IEEE Access,10.1109/ACCESS.2020.3022990,IoT_Embedded,1,,4,1,IoT,S10,REMOVED_DUP,N/A,"DUPLICATE: Duplicate of 020 (Seo ARM Cortex-M4, DOI 10.1109/ACCESS.2020.3022990)"
090,Post-Quantum Authentication in TLS 1.3,Sikeridis et al.,2020,Other,NDSS,10.14722/ndss.2020.24203,VPN_ZeroTrust,1,,5,1/3,TLS/VPN,S4,REMOVED_DUP,N/A,"DUPLICATE: Duplicate of 047 (Sikeridis NDSS 2020, re-entered under VPN subtopic)"
092,Recommendation for Stateful Hash-Based Signature Schemes,Cooper et al.,2020,NIST,NIST SP 800-208,10.6028/NIST.SP.800-208,Regulatory,1,,5,N/A,Gov/PKI,S7,REMOVED_DUP,N/A,"DUPLICATE: Duplicate of 062 (Cooper NIST SP 800-208, DOI 10.6028/NIST.SP.800-208)"
093,Commercial National Security Algorithm Suite 2.0,NSA,2022,Other,NSA Advisory,N/A,Regulatory,1,,5,N/A,Gov/NSS,S7,REMOVED_DUP,N/A,"DUPLICATE: Duplicate of 046 (NSA CNSA 2.0 Advisory, re-entered under VPN subtopic)"
101,Towards Post-Quantum Security for Cyber-Physical Systems,Busch et al.,2021,Scopus,ESORICS,10.1007/978-3-030-88418-5_15,Crypto_Agility,1,,4,1/3,ICS/VPN,S13,REMOVED_DUP,N/A,"DUPLICATE: Duplicate of 087 (Busch ESORICS 2021, DOI 10.1007/978-3-030-88418-5_15)"
102,Migration to Post-Quantum Cryptography in Internet Protocols,Hoffman,2023,IEEE_Xplore,IEEE S&P Mag,10.1109/MSEC.2023.3241111,Crypto_Agility,1,,4,All,All,S13,REMOVED_DUP,N/A,"DUPLICATE: Duplicate of 065 (Hoffman IEEE S&P Mag 2023, DOI 10.1109/MSEC.2023.3241111)"
119,Lattice-Based Cryptography for IoT in a Quantum World: Are We Ready?,Khalid et al.,2021,IEEE_Xplore,IEEE IoT J,10.1109/JIOT.2020.3033060,AI_ML_PQC,1,,4,1/3,IoT,S10,REMOVED_DUP,N/A,"DUPLICATE: Duplicate of 035 (Khalid IoT J 2021, DOI 10.1109/JIOT.2020.3033060)"
